category,question,answer
aegon life insurance,whom should i contact if i have concerns or complaints related to aegon life group term plus insurance plan,for all queries please write to groupcareaegonlifecom or call on 18002099090 between 9 am to 7 pm from monday to saturdayfor any complaints or escalations please write to insurancegroflipkartcom
aegon life insurance,can i add more than one nominee as part of the aegon life group term plus insurance plan,no the option to add more than one nominee is currently not available however you can only replace or correct the existing nominee details name age gender and relationship by using the addupdate nominee option available under the my policy page of flipkart app the age of the nominee should be between 18 and 99 years
covid19 protect coronavirus insurance,can i purchase more than one covid19 protect policy can i purchase the policy for my family or friends,no you can only purchase one policy for yourself under the current restrictions however your family or friends can purchase policies for themselves from their own accounts
covid19 protect coronavirus insurance,can i update or correct my personal details after purchasing the covid19 protect policy,you can only update the primary email id from the my orders section of your flipkart app after purchasing the policy please ensure that the rest of the flipkart details are accurately entered when you buy the policy
covid19 protect coronavirus insurance,how can i add a nominee to my covid19 protect policy ,you dont need to add nominee details for this policy any of your legal heirs will be considered as a nominee by default
covid19 protect coronavirus insurance,what is the eligible age group for digit illness group insurance  cover for coronavirus indemnity,individuals in the age group of 1860 years can purchase standalone policies provided heshe is not ineligible as per the terms and exclusions of the cover standalone policies for children below 18 years of age are not available
covid19 protect coronavirus insurance,if i get quarantined will digit illness group insurance  cover for coronavirus indemnity cover the hospitalisation expenses incurred,yes coverage for quarantine in a hospital will be paid to the insurer only if heshe is later confirmed positive with covid19 provided that not more than 30 days have lapsed between both the incidents ie getting quarantined and testing positive for covid19
covid19 protect coronavirus insurance,what is the process for raising a claim under digit illness group insurance  cover for coronavirus indemnity,in case of any unfortunate event if you have to make a claim under this policy you will need to notify the insurer by calling on 18002585942 or by writing to healthclaimsgodigitcom and provide relevant information specified within the relevant section of the policy certificate
covid19 protect coronavirus insurance,if i have a recent travel history to a foreign country will i be eligible for digit illness group insurance  cover for coronavirus indemnity,you are not eligible for cover under this policy if you have travelled outside india in the last 30 days prior to the date of purchase
covid19 protect coronavirus insurance,can i claim immediately after the policy purchase or is there any waiting period applicable in the covid19 protection cover by icici lombard,there will be an initial waiting period of 15 days starting from the policy start date for anyone who has bought this policy the policyholder is not eligible for the benefits under this policy during this waiting period
covid19 protect coronavirus insurance,is there any waiting period applicable for digit illness group insurance  cover for coronavirus indemnity,yes an initial waiting period of 15 days will be applicable for anyone who has bought this policy
covid19 protect coronavirus insurance,what is the process for raising a claim for the covid19 protection cover by icici lombard,in case of any unfortunate event if you need to make a claim under this policy you will need to notify the insurer immediately on toll free number 1800 2666 working hours 9 am to 9 pm or on the website wwwicicilombardcomalong with the completed and signed claim form physical or digital you will have to provide all the relevant documents specified within the relevant section of the policy for the benefit being claimed within 30 days
covid19 protect coronavirus insurance,what is the tele consultation service provided on the covid19 protection cover by icici lombard,the policyholder will be allowed 4 free calls to take any consultation with certified medical practitioners who are available on call 24 hours a day for 365 days
covid19 protect coronavirus insurance,what are the other important exclusions in digit illness group insurance  cover for coronavirus indemnity that i should be aware of,other major exclusions are as follows hospitalisation expenses that are not part of the treatment for coronavirus disease covid19 will not be covered insured members already treated for or quarantined for coronavirus disease covid19 before the policy issuance will not be covered treatment taken outside india will not be covered any preexisting condition whether declared or undeclared will not be covered home hospitalisation domiciliary hospitalisation expenses will not be covered hospitalisation expenses for patients only under investigation with inconclusive medical report will not be covered test report for coronavirus disease covid19 conducted from centres other than govticmr authorized test centres in india and national institute of virology pune will not be considered
covid19 protect coronavirus insurance,what is the health assistance benefit provided as part of covid19 protection cover by icici lombard,health assistance will be provided through a dedicated helpline of the insurer the health assistance team is dedicated to assist the insured person in the following ways identifying specialisthospital fixing an appointment with medical practitioners wherever applicable on best effort basis providing options on suitable network providers providing information on ailments and possible lines of treatment provision for a second medical opinionyou can either call helpline number 040 6627 4205 during official hours  9 am to 9 pm monday to saturday excluding public holidays or write to healthassistanceicicilombardcom to avail this facility
covid19 protect coronavirus insurance,what are the eligibility criteria for digit illness group insurance cover for coronavirus indemnity,you are eligible for buying this policy if you1 do not have any international travel history in the last 30 days before the purchase of the policy2 are not suffering from disease related to diabetesheartlungskidneyliver cancer stroke and any condition that needs ongoing medication treatment
covid19 protect coronavirus insurance,what am i covered for under the digit illness group insurance cover for coronavirus indemnity,this policy will cover the hospitalization costs incurred in case you are tested positive for covid19 the benefits that can be availed under this policy are as follows pre and posthospitalization cover for 30 days  60 days any medication consultation charges incurred in pre and posthospitalization shall also be covered no restriction on room rent no restriction on icu rent 1 of the sum insured for ambulance second medical opinion covered
covid19 protect coronavirus insurance,what is the chatvirtual consultation provided as part of covid19 protection cover by icici lombard,chat is a form of consultation provided by healthcare professionals through the insurers online platform for routine health queries this service can be availed during official hours that is between 9 am and 9 pm from monday to saturday excluding public holidays
covid19 protect coronavirus insurance,what will i get as proof of insurance after i purchase the covid19 protect policy,you will get a policy certificate mailed to your email address provided at the time of purchase within 48 hours of buying it you will also be able to view or share the same from the my orders section of your flipkart account
covid19 protect coronavirus insurance,if i have a recent travel history to a foreign country will i be eligible for the covid19 protection cover by icici lombard,you are not eligible for cover under this policy if you have travelled outside india after december 31 2019
covid19 protect coronavirus insurance,what am i covered for under the covid19 protection cover by icici lombard,this cover will help you if you are tested positive for covid19 coronavirus disease as part of which you get the sum insured as a lump sum amountadditionally you can also avail services such as health assistance doctor on chat emergency ambulance and tele consultation with a medical practitionerkindly read the policy document for details on these services
covid19 protect coronavirus insurance,what is the ambulance assistance service provided by the covid19 protection cover by icici lombard,icici lombard will provide assistance to arrange for an ambulance in case of any not covid19 specific life threatening medical need the service can be utilized unlimited number of times subject to availability of services in that particular citylocation kindly visit icicilombardcom for an updated list of citieslocations where the services are provided the cost of transportation will have to be borne by the customer
covid19 protect coronavirus insurance,what is the eligible age group for the covid19 protection cover by icici lombard,individuals in the age group of 1875 years can purchase this cover provided heshe is not ineligible as per the terms and exclusions of the coverindividuals below 18 years of age are not eligible for the cover
covid19 protect coronavirus insurance,what happens if i purchase digit illness group insurance  cover for coronavirus indemnity and then travel to a foreign country where i contract the virus and have to undergo treatment will my policy cover the expenses incurred in this scenario,no any treatment taken outside india will not be covered under this policy
flipkart quick,what is flipkart quick,flipkart quick is a new delivery service that guarantees express delivery within 90 minutes as well as slotted delivery of items for categories like grocery fresh fruits and vegetables lifestyle and mobiles
flipkart quick,how can i shop on flipkart quick,you can shop for your daytoday essentials on flipkart quick by following these steps1 visit the flipkart quick section 2 add items to your cart and build a basket worth minimum rs 150 to continue with your order if the order value is more than rs 500 it will be eligible for free delivery3 choose your preferred time slot for delivery4 proceed to choose your preferred payment mode and place your orderflipkart quick is available on our app android and ios mobile site as well as our website
flipkart quick,how can i track my flipkart quick order,you can track your order from the my orders section of your flipkart account
flipkart quick,can i choose to not accept a few items from my flipkart quick order at the time of delivery,yes you can but if the new order value of the items you wish to keep is below rs 500 shipping charges will be applicable in case the order value falls below rs 150 your order will get cancelled
flipkart quick,can i reject the flipkart quick order at the time of delivery,yes you can choose not to accept the order if you have already paid for the order it will be refunded to the original payment source
flipkart quick,can i add more items after i have placed a flipkart quick order,no items cannot be added to an order after it is placed
flipkart quick,is the delivery for flipkart quick free or chargeable,for both express delivery and slotted delivery if the order value is above rs 500 then the delivery will be free in case the order value is less than rs 500 shipping charges will be applicable
flipkart quick,in case i do not need a few items from the flipkart quick order how do i cancel it,you may choose not to accept those items at the time of delivery in case you have paid any amount it will be refunded to the original payment source
flipkart quick,what is express delivery,it is a new delivery model that ensures delivery of items like grocery fresh fruits vegetables lifestyle and mobile categories within 90 minutes of it being placed if the order value is more than rs 500 delivery is free in case the order value is less than rs 500 shipping charges will be applicable
flipkart quick,is there a gift wrap option available for flipkart quick orders,no gift wrap option is currently not available
flipkart quick,is there a minimum purchase amount for flipkart quick orders,yes the minimum order value for an order to be fulfilled is rs 150
flipkart quick,what are the different payment options available for flipkart quick,you can choose to pay for your order through netbanking credit card debit card upiwallets or by cash
flipkart quick,can i cancel a part of my flipkart quick order after i have placed it,yes until your order is packed you can choose to cancel a part of it you can check the status of your order in the my orders page of your flipkart account
flipkart quick,can i choose a preferred time slot for the delivery of flipkart quick orders,yes you can choose your preferred time from available slots for the same day
flipkart quick,can i modify my chosen time slot for the delivery of flipkart quick orders,no once you have chosen your preferred delivery slot it cannot be modified
flipkart quick,can i change the mode of payment once i have placed a flipkart quick order,once an order is placed payment mode cannot be changed currently
flipkart quick,can i change the delivery address after i have placed a flipkart quick order,no once an order is placed the delivery address cannot be changed
supercoins,what are supercoin milestones,supercoin milestones let customers unlock benefits by earning a specific number of supercoins
supercoins,when benefits are unlocked as part of supercoin milestones will there be deduction of supercoins,no there will be no deduction of supercoins even when benefits are unlocked
supercoins,how long will the benefit be unlocked as part of my supercoin milestones,once you reach the specified milestone by earning required number of supercoins and unlock a benefit it will be available for a year however if you have the required number of supercoins even after a year the benefit you have unlocked will be automatically renewed for another year 
supercoins,how do i renew my benefits as part of supercoin milestones,in case you have required supercoins as per the specified milestone the benefits that you have unlocked as part of supercoin milestones will be renewed and you can continue to avail them even after a year 
supercoins,what is cash and coins for rewards program,cash and coins for rewards enables customers to redeem select rewards offered by third party using a combination of supercoins and a specific amount the amount and the number of supercoins that have to be used to redeem a reward are predetermined and cannot be changed
supercoins,who all can avail cash and coins for rewards,cash and coins for rewards is available for all flipkart customers based on the avaialibity of your supercoin balance you can redeem existing rewards 
supercoins,can i choose the number of supercoins that can be redeemed for a purchase as part of cash and coins for rewards program,the amount to be paid and the supercoins that can be redeemed as part of the cash and coins for rewards is a predetermined combination a reward can be purchased by redeeming only the exact number of supercoins mentioned on the reward page
supercoins,can i buy rewards using only prepaid mode of payment and redemption of supercoins as part of cash and coins for rewards program,no currently as part of cash and coins for rewards program rewards can be purchased only by paying using a combination of specific amount and by redeeming the number of supercoins mentioned
supercoins,can i buy all the listed rewards using prepaid mode of payment and by redeeming supercoins as part cash and coins for rewards,no the option to use cash and coins is applicable only on select rewards under the rewards store of supercoin zone
supercoins,can i purchase rewards using cash and coins option from desktop,cash and coins for rewards program is currently available only on our app and msite 
supercoins,can i make the payment using prepaid mode of payment and gift card as part of the cash and coins for rewards,the amount specified to redeem a reward can only be paid through a prepaid mode of payment such as debit credit card and netbanking please note the prepaid methods mentioned cannot be combined to complete the payment option to pay via gift card is currently not available
supercoins,where can i find the code for the rewards claimed as part of the cash and coins for rewards,you can get codes for claimed rewards in the claimed rewards section of the rewards store under supercoin zone
supercoins,will i get supercoins for using cash and coins for rewards,there will be no supercoins earnings as part of cash and coins for rewards you can only redeem supercoins to avail a reward
supercoins,can i cancel or return a reward as part of the cash and coins for rewards for program,no once a reward is claimed it cannot be cancelled
supercoins,which are the thirdparty partner stores where i can use supercoin pay feature,you can check out the list of thirdparty partner stores where you can use supercoin pay feature and redeem supercoins by visiting the supercoin zone we are constantly working on expanding this list so you can avail this feature across a widerange of stores
supercoins,can supercoin pay feature be used to shop online,yes supercoin pay feature can be used to shop online based on thirdparty partner stores available in the supercoin zone
supercoins,is it necessary to register on twid innotarget fashalot retail private limited or at the thirdparty partner store to use supercoin pay feature,no it is not necessary to register on twid innotarget fashalot retail private limited or at the thirdparty partner store to use supercoin pay feature
supercoins,is it necessary for me to be registered with the same contact number at the thirdparty partner store for me to use supercoin pay feature,no it is not necessary for you to be registered with the same contact number at the thirdparty partner store to be able to use the supercoin pay feature
supercoins,how can i know if the store i am at has the option of using supercoin pay feature,please ask the cashier at the store if the option to pay through supercoin pay feature is available with them or you can look for a qr code scanner with flipkart logo and supercoin pay option
supercoins,what does it mean if a store displays a supercoin pay qr code,supercoin pay feature allows you to make payment for the product purchased at a thirdparty partner store and to redeem supercoins in the supercoin zone of your flipkart account to use this feature open the qr code scanner available in the supercoin zone on the app and scan the qr code to be directed to the payment page
supercoins,why is my preferred store not showing up for supercoin pay on the flipkart app,supercoin pay feature is currently available only with select thirdparty partner stores if youre unable to find a specific store or brand for supercoin pay on the flipkart app it means that it is not listed as a partner store with us at the moment you can visit the supercoin zone and click on stores nearby to find the list of the partner stores rest assured we are working on expanding our partner stores so you can avail this feature
supercoins,how do i know if a thirdparty partner store accepts supercoin pay if there is no qr code scanner available,to check if a thirdparty store has partnered with us for the supercoin pay feature please check with the cashier at the store or you can visit the supercoin zone and check the list of the partner stores using stores nearby option
supercoins,what are inapp offers for supercoin pay,inapp offers are offers provided by brands and banks as part of supercoin pay with terms and conditions applicable these offers help you save extra on your spendings at thirdparty partner stores to avail an offer please scan the qr code enter the bill amount and select apply brand voucher by choosing the relevant discount available
supercoins,what is the purpose of the scratch card in supercoin pay,on every successful transaction using supercoin pay feature you will get a scratch card by twid innotarget fashalot retail private limited with terms and conditions applicable once you scratch it you will either find supercoins or an offer inside any supercoins obtained as part of the offer will be credited to the coin balance section of the supercoin zone within 48 hours and it will also reflect in the coin activity section
supercoins,where will i find a scratch card after using supercoin pay feature for an order,if an order is eligible for scratch card by twid innotarget fashalot retail private limited it will be added soon after transaction is successful please go to my orders page of your flipkart account tap on the supercoin pay logo at the top of the page and choose supercoin pay from the menu there will a tab at the top of the page with scratch cards and you will be able to find your scratch card on that particular tab please note that offers are subject to terms and conditions
supercoins,what are the citiesstates that have thirdparty partner stores to redeem the supercoin pay feature,supercoin pay feature is available all over the country you can make payments at any thirdparty store listed on supercoin zone section of your flipkart account to see the list of stores near you where you can pay using supercoin pay the app will need access to your devicesphones location in case you would like to go ahead with this feature please provide necessary permissions to the flipkart app remember stores that are not listed for your area or not showing up on the app will not accept the payment through supercoin pay
supercoins,can i scan any qr code in the store to initiate the payment for an order using supercoin pay feature,no only twid innotarget fashalot retail private limited or qr codes associated with supercoin pay feature can be scanned to complete payment for an order using supercoin pay feature
supercoins,for how long is a payment code as a part of supercoin pay valid once it is generated,a payment code generated will be valid for 24 hours hours
supercoins,what all brands are part of the supercoin pay program,you can check details of partnered brands on the supercoin zone of flipkart app however please continue checking the app as we will keep adding other brands to the existing list
supercoins,how secure is the payment through supercoin pay,twid innotarget fashalot retail private limited platform is designed to ensure your data is safe and secure this is a pci dss certified platform that makes your transaction completely safe your data is 256 bits encrypted and with your full optin consent and transparency
supercoins,do i have to manually unlock a scratch card as part of supercoin pay,yes you would need to tap on a scratch card by twid innotarget fashalot retail private limited to unlock your surprise reward please note that offers are subject to terms and conditions
supercoins,what is supercoin pay feature,supercoin pay enables you to redeem supercoins to avail discounts in combination with a prepaid payment mode for purchases on flipkart platform and at thirdparty partner storesplease note you can redeem supercoins for discounts on a product on flipkart platform based on the value you see on the product page and as per the terms and conditions of the participating banks or the payment mode however at a thirdparty partner store you may be able to redeem all your supercoins based on the final bill value
supercoins,how can i redeem supercoins through supercoin pay feature during my purchase at a thirdparty partner store or on flipkart platform,to avail discounts by redeeming supercoins through supercoin pay at a third party store is easy heres how you can use the feature open the flipkart app visit the supercoin zone click on stores nearby search for the store you are at and select it enter the final bill amount once the cashier confirms it select any applicable offer and supercoins points to be redeemed enter the otp sent to your registered phone number to verify the number of supercoins being redeemed in case of only supercoins redemption once the verification is done you will be redirected to the confirmation page which will display a payment code show this code to the cashier and the transaction will be completed in case of prepaid mode of payment proceed to pay the balance amount using your preferred payment method from creditdebit card or netbanking option once the amount is added you will be redirected to the confirmation page which will display a payment code show this code to the cashier and the transaction will be completedalternatively you can scan qr code powered by twid innotarget fashalot retail private limited at partner stores for quick access and payment to scan please visit the supercoin zone on the flipkart app and click on the qr code scanner at the top right cornerheres how you can use the feature to redeem supercoins on flipkart open the flipkart app add the product to the cart choose the supercoin pay from the available payment option to redeem supercoins for dicounts along with any other prepaid payment mode of participating banks to complete your purchase
