category,question,answer
bounce,do i get a spare tyre with bounce 2wheelers,no a spare tyre is not provided with bounce electric 2wheeler
bounce,what aftersales services are being provided by bounce for 2wheelers,please contact the brands customer support team at 18003092830 or you can choose to write to them at helpbounceinfinitycom to get more details on the aftersales services provided by them
bounce,what is the average cost of one service for bounce 2wheelers,the average cost of service will depend on the condition of the vehicle for more details please contact the brands customer support team at 18003092830 or you can choose to write to them at helpbounceinfinitycom you can also contact the brand authorised dealer for assistance
bounce,will flipkart deliver the bounce 2wheeler at my home,no after the registration process the brand authorised dealer will contact you to handover the vehicle at their location
bounce,how do i contact bounces customer support team,you can contact bounces customer support team at 18003092830 or you can choose to write to them at helpbounceinfinitycom
bounce,what subsidies are being offered by bounce and how to claim them,for bounce vehicles the central subsidy is already included and you do not have to apply for it again the authorised dealers will assist you with the state subsidies at the time of the vehicle deliverynote all subsidy discounts will be provided to customers if they are firsttime electric scooter buyer
bounce,when and how many times do bounce vehicles require servicing,bounce vehicles must be serviced every 6 months or after 6000 kilometers whichever is earlier
bounce,is there a battery subscription model for bounce 2wheelers,please note the brand offers battery subscriptionbased models however currently they are not available on flipkart
bounce,the address while ordering bounce vehicle on flipkart is different from the one on my address proof aadhar card what should i do now,please cancel the order and place a new order with the correct address for more details you can also contact the brand authorised dealer
bounce,how much electricity is required to charge the battery of a bounce vehicle,bounce vehicles battery consumes 23 kwh to get completely charged
bounce,can i buy more than one bounce vehicle in my namesame flipkart account,no only one vehicle can be purchased through a flipkart account please note the price displayed on the product page includes subsidy provided by the central government and is linked to your aadhar card and that would mean that this price is applicable only for your first purchase of an electrical vehicle
bounce,can i choose a different model of the bounce 2wheeler at the brand authorised dealer after doing the test drive,in case you want to buy a different model than the one you have already purchased after test drive at the brand authorised dealer you can cancel the existing order and place a new order for the desired model please note the option to cancel the order will not be available after the submission of documents required for processing registration
bounce,how do you make sure that i dont get unwarranted calls for cross sellupsell from bounceinsurance partners etc,please note bounce will not contact you without your consent in case you receive any unwarranted calls please contact the brands customer support team at 18003092830 or you can choose to write to them at helpbounceinfinitycom and they will help you
bounce,in case i want to relocate to a different state do i need to get the bounce vehicle registered in that state also and will the brand help me with that,in case you relocate to a different state please contact the local regional transport office for assistance with registration change
bounce,will bounce crosssellup sell when i visit the brand authorised dealer,please note once youve completed the purchase on flipkart the brand authorised dealer will not market any other products however they may recommend accessories that may be suitable for your vehicle
ampere,is the price shown on the product page for ampere magnus ex the final amount,please note the price shown on the product page is the exshowroom price of the vehicle you will also have to pay for registration insurance any other accessories and valueadded services opted as applicable at the brand authorised dealer
ampere,can i pay for the vehicle registration and insurance on flipkart for ampere magnus ex,currently the option to pay for the registration and insurance is not available on flipkart please note the vehicle registration amount needs to be paid directly to the brand authorised dealer you can choose to buy vehicle insurance from the dealer or on your own from a different insurance service provider
ampere,what is the advantage of buying ampere magnus ex through flipkart,if you choose to buy the 2wheeler on flipkart then the vehicle will be delivered to you within 15 days by the brand authorised dealers in case you book the vehicle at a showroom it may take up to 90 days for the vehicle to be delivered
ampere,what is the process after paying the exshowroom price for ampere magnus ex on flipkart,once youve paid the exshowroom price for the 2wheeler on flipkart the authorised dealer will contact you within 48 hours to initiate the process of registration after this you will need to visit the brand authorised dealer to submit the required documents and within the next 710 days the 2wheeler will be handed over to you at the authorised dealers location
ampere,how can i track my order for ampere magnus ex after completing my payment on flipkart,tracking your order for a 2wheeler on flipkart is easy and can be done through the my orders section of your flipkart account you can also choose to contact the brand authorised dealer to know more about the status of your 2wheeler
ampere,once i have paid for the registration and the insurance how do i track my order for ampere magnus ex,for ampere you can track the order status of your 2wheeler by visiting the my orders section of your flipkart account you can also contact the brand authorised dealer to know the status of your vehicle
ampere,what subsidies are being offered by ampere and how to claim them,for bounce vehicles the central subsidy is already included and you do not have to apply for it again the authorised dealers will assist you with the state subsidies at the time of the vehicle delivery note all subsidy discounts will be provided to customers if they are firsttime electric scooter buyer
ampere,is the price for ampere magnus ex inclusive of subsidy,please note the price displayed on the product page includes subsidy provided by the central government and is linked to your aadhar card and that would mean that this price is applicable only for your first purchase of an electrical vehicle
ampere,can i choose my own insurance partner for ampere 2wheelers,you can choose to buy vehicle insurance from the dealer or on your own from a different insurance service provider in case you do not want to purchase insurance through the dealer please collect the 2wheeler invoice from the dealer for the purchase of the insurance policy as mandated by the road transport authority please buy insurance with a 5year term additionally it is also mandatory to buy a personal accident cover if you do not already have one
ampere,what charging options are available with ampere magnus ex is there a separate cost associated with it,a charger will be provided with the 2wheeler and can be plugged into any 5a socket
ampere,will ampere crosssellupsell when i visit the brand authorised dealer,please note once youve completed the purchase on flipkart the brand authorised dealer will not market any other products however they may recommend accessories that may be suitable for your vehicle
ampere,what aftersales services are being provided by flipkart for ampere 2wheelers,please note there will be no aftersales services provided by flipkart kindly contact the brands customer support team at 18001239262 or write to them at customersupportamperevehiclescom for any assistance needed after the purchase of the vehicle you can also choose to contact the brand authorised dealer
ampere,what aftersales services are being provided by ampere for 2wheelers,for servicerelated details please contact the brand at 1800 123 9262 or write to them at customersupportamperevehiclescom you can also choose to contact the brand authorised dealer
ampere,how do you make sure that i dont get unwarranted calls for crosssellupsell from ampereinsurance partners,please note ampere will not contact you without your consent in case you receive any unwarranted calls please contact the brands customer support team at 18001239262 or you can choose to write to them at customersupportamperevehiclescom and they will help you
ampere,why am i not able to see the option to buy an ampere 2wheeler for my pincode,the option to purchase the 2wheeler is available only in select cities rest assured the brand authorised dealers are working on expanding this
ampere,what are the documents required for the entire process of buying an ampere magnus ex on flipkart,the following documents need to be submitted to the brand authorised dealer to complete the purchase of a 2wheeler aadhar card pan card address proof passport size photo
ampere,can i submit my documents online for ampere magnus ex and not visit the brand authorised dealer,yes you can submit the required documents via email the authorised dealer will assist you in case a hard copy is needed for documentationverification
ampere,what will happen if the ampere authorised dealer who will contact me is very far from my location,please be assured that the nearest authorised dealer will contact you as part of the purchase of a 2wheeler on flipkart
ampere,will i get the option to test ride for ampere magnus ex how many times will i be allowed to take test rides as part of an order,you can take multiple test rides by visiting any brand authorised dealership
ampere,in which cities can the purchase of ampere magnus ex be made,while ampere scooters can be purchased across 250 cities across the country you can purchase magnus ex on flipkart only in bangalore pune jaipur and kolkata rest assured brand authorised dealers are working on expanding the list of cities
ampere,in which cities is ampere operational,ampere by greaves is operational in more than 250 cities in the country
ampere,is there any loan facility available for the purchase of an ampere magnus ex on flipkart,currently there is only nocost emi option available on flipkart for the purchase of 2wheeler vehicles
ampere,is there a battery subscription model for ampere magnus ex,currently a battery subscription model is not available for ampere magnus ex
ampere,what accessories will be provided with magnus ex,standard accessories that will be provided with amperes magnus ex 2wheeler are centre stand side stand charger tool kit and firstaid kit you can contact the brand authorised dealer for additional accessories
ampere,is the warranty being offered by flipkart for ampere magnus ex,please note the warranty will be provided by the brand
ampere,do i need to have a driving license to ride ampere magnus ex,please note that you will need a 2wheeler license to ride ampere magnus ex
ampere,how quickly does the battery for ampere magnus ex charge again,battery for ampere vehicles gets fully charged within 67 hours
ampere,do i get a spare tyre with ampere magnus ex,no a spare tyre is not provided with ampere magnus ex
ampere,how much electricity is required to charge the battery of ampere magnus ex,ampere magnus exs battery consumes 23 kwh to get completely charged
ampere,when and how many times does ampere magnus ex require servicing,ampere electric vehicles must be serviced every 6 months or after 6000 kilometers whichever is earlier
ampere,in case i want to relocate to a different state do i need to get ampere magnus ex registered in that state also and will the brand help me with that,in case you relocate to a different state please contact the local regional transport office for assistance with registration change
ampere,what is the subscription plan being offered by amperedealership in addition to the registration and insurance cost,currently there is no subscription plan offered by ampere rest assured the brand is working on introducing the same in the future
ampere,will flipkart deliver ampere magnus ex to my home,no after the registration process the brand authorised dealer will contact you to handover the vehicle at the dealers location
ampere,i have bought ampere magnus ex but i want to have a different model what should i do,in case you want to buy a different model you will have to let the brand authorised dealer know your requirement before the insurance and registration process is initiated please note any request for a new variant can be done based on the availability of the stock with the dealer alternatively you can also cancel the existing order and place a new order before the submission of documents required for processing registration
ampere,what is the warranty being offered by ampere,ampere magnus ex electric scooter comes with a warranty of 3 years or 20000 km whichever is completed first for more details you can contact the brand at 1800 123 9262 or write to them at customersupportamperevehiclescom you can also choose to contact the brand authorised dealer
ampere,how long does the ampere magnus exs battery last,ampere magnus exs battery will last for a distance of 80100 kilometers after it is fully charged for more information on battery life please visit the brand website
ampere,the address while ordering ampere 2wheeler on flipkart is different from the one on my address proof aadhar card what should i do now,please cancel the order and place a new order with the correct address for more details you can also contact the brand authorised dealer
ampere,will i get any extra discountnocost emi at the ampere dealership for insurance and vehicle registration charges,please reach out to the brand authorised dealer for any discountrelated information on insurance if it is being purchased from them kindly note the vehicle registration charge is a government tax and is the same for all it does not include any discount or the option to pay through emi
ampere,can i buy more than one ampere vehicle in my namesame flipkart account,no only one vehicle can be purchased through a flipkart account please note the price displayed on the product page includes subsidy provided by the central government and is linked to your aadhar card and that would mean that this price is applicable only for your first purchase of an electrical vehicle
ampere,what are the accepted address proofs that i can use for my ampere magnus ex registration so that i can ensure that i have the required documents before making the purchase on flipkart,address proof documents that need to be submitted at the regional transport office may vary across states however these are the commonly accepted address proofs aadhar card passport bank passbook  voter id electricity bill lpg connection bill water bill registered rental agreement
bgauss,is the price shown on the product page for a bgauss 2wheeler the final amount,please note the price shown on the product page is the exshowroom price of the vehicle you will also have to pay for registration insurance any other accessories and valueadded services opted as applicable at the brand authorised dealer
bgauss,why is the option to buy a bgauss 2wheeler not available at my pincode,sorry the option to purchase the 2wheeler is available only in select cities rest assured the brand authorised dealers are working on expanding this
bgauss,what is the advantage of buying a bgauss 2wheeler vehicle through flipkart,if you choose to buy 2 wheeler on flipkart then the vehicle will be delivered to you within 15 days by the brand authorised dealers in case you book the vehicle at a showroom it may take up to 90 days for the vehicle to be delivered
bgauss,what is the process after paying the exshowroom price for a bgauss 2wheeler on flipkart,once youve paid the exshowroom price for the 2wheeler on flipkart the authorised dealer will contact you within 48 hours to initiate the process of registration after this you will need to visit the brand authorised dealer to submit the required documents and within the next 710 days the 2wheeler will be handed over to you at the authorised dealers location
bgauss,what are the documents required for the entire process of buying a bgauss 2wheeler on flipkart,the following documents need to be submitted to the brand authorised dealer to complete the purchase of a 2wheeler aadhaar card mobile number linked to the aadhaar card any residence proof driving license
bgauss,can i submit my documents online for a bgauss 2wheeler and not visit the brand authorised dealer,yes you can submit the required documents via email the authorised dealer will assist you in case a hard copy is needed for documentation
bgauss,what will happen if bgauss brand authorised dealer who will contact me is very far from my location,please be assured that the nearest authorised dealer will contact you as part of the purchase of a 2wheeler on flipkart
bgauss,will i get the option to test drive a bgauss 2wheeler how many times will i be allowed to take a test drive in the same order,you can take multiple test rides by visiting the nearest brand authorised dealership
bgauss,how can i track my order for the bgauss 2wheeler after completing my payment on flipkart,tracking your order for a 2wheeler on flipkart is easy and can be done through the my orders section you can also choose to contact the brand authorised dealer to know more about the status of your 2wheeler
bgauss,once i have paid for the registration and the insurance how do i track my order for the bgauss 2wheeler,for bgauss you can track the order status of your 2wheeler by visiting my orders section you can also choose to contact the brand authorised dealer to know more about the status of your 2wheeler
bgauss,what subsidies are being offered by bgauss and how to claim them,for bgauss vehicles the central subsidy is already included and you do not have to apply for it again the authorised dealers will assist you with the state subsidies at the time of the vehicle delivery note all subsidy discounts will be provided to customers if they are firsttime electric scooter buyer
bgauss,is the price for a bgauss 2wheeler inclusive of subsidy,please note the price displayed on the product page includes subsidy provided by the central government and is linked to your aadhaar card and that would mean that this price is applicable only for your first purchase of an electrical vehicle
bgauss,is there any loan facility available for the purchase of a bgauss 2wheeler on flipkart,currently there is only a nocost emi option available on flipkart for the purchase of 2wheeler vehicles
bgauss,can i choose my own insurance partner for a bgauss 2wheeler,you can choose to buy vehicle insurance from the dealer or on your own from a different insurance service provider once youve purchased the insurance please share details with the authorised dealer so that they can initiate the process of registration at the rto
bgauss,is there a battery subscription model for bgauss 2wheelers,no currently there is no battery subscription model offered by bgauss
bgauss,there have been recent reports of batteries catching fire how do i know that bgauss 2wheelers are safe,brand has confirmed that they have followed all safety norms set by arai including ip67 and a smart bms to ensure safety of all vehicles batteries are made with aluminium casing and 21700 cells with very high thermal efficiency this is combined with temperature sensors and induced air cooling which gets activated at 40 degrees
bgauss,what accessories will be part of bgauss 2wheelers do i have to pay separately for accessories,there are no accessories provided with bgauss 2wheelers if you like you can buy them separately
bgauss,what is the warranty being offered by bgauss,bg b8 bg d15i and bg d15 pro come with a warranty of 3 years or 36000 kilometers whichever is completed earlier whereas bg a2 has a warranty of 3 years or 24000 kilometers whichever is completed earlier
bgauss,can i buy more than one bgauss 2wheeler in my namesame flipkart account,no only one vehicle can be purchased through a flipkart account please note the price displayed on the product page includes subsidy provided by the central government and is linked to your aadhaar card and that would mean that this price is applicable only for your first purchase of an electrical vehicle
bgauss,do i need to have a driving license to ride a bgauss 2wheeler,please note a driving license is required to ride bg b8 bg d15i and bg d15 pro whereas a driving license is not required to ride bg a2
bgauss,what charging options are available with bgauss 2wheelers,for a bgauss vehicle a charger is provided with the vehicle and the battery provided is removable you can plug it into a normal 5 amps socket and charge it like you charge your mobile phone
bgauss,how long does the battery last for bgauss 2wheelers,the battery for bg d15i and bg d15 pro will last for 70000 to 80000 kilometers which is 8 to 10 years depending on the individual usage the battery for bg a2 and bg b8 will last for 40000 kilometers depending on usage
bgauss,how quickly does the battery for bgauss 2wheelers charge again,please note the battery for bg a2 will take 1 hour 45 minutes to get 80 charged however it will take 2 hours 15 minutes to get 100 charged battery for bg b8 will take 2 hours to get 80 charged and 3 hours to get 100 chargedbatteries for bg d15i and bg d15 pro will take 4 hours to get 80 charged and 5 hours 30 minutes to get 100 charged
bgauss,do i get a spare tyre with a bgauss 2wheeler,no a spare tyre is not provided with a bgauss electric 2wheeler
bgauss,how much electricity is required to charge the battery of a bgauss vehicle,bg a2 and bg b8 consume 15 units of electricity bg d15i and bg d15 pro consume 35 units of electricity
bgauss,what aftersales services are being provided by flipkart for bgauss 2wheelers,please note there will be no aftersales services provided by flipkart kindly contact the brands customer support for any assistance needed after the purchase of the vehicle you can also check with the brand authorised dealer
bgauss,what aftersales services are being provided by bgauss for 2wheelers,please note the 1st and the 4th services are free of cost any other services may be chargeable for more details kindly get in touch with the brand at 8291939393
bgauss,when and how many times does a bgauss vehicle require servicing,bgauss vehicles must be serviced twice a year
bgauss,what is the average cost of one service for a bgauss 2wheeler,the average cost of service will depend on the condition of the vehicle however for a standard service it may range from rs 300 to rs 350 for more details you can contact the brand at 8291939393 or you can choose to contact the brand authorised dealer
bgauss,in case i want to relocate to a different state do i need to get the bgauss vehicle registered in that state also and will the brand help me with that,in case you relocate to a different state please contact the local regional transport office for assistance with registration change
bgauss,will flipkart deliver the bgauss 2wheeler to my home,for deliveryrelated queries please contact the brand at 8291939393 you can also check with the brand authorised dealer
bgauss,i have bought a bgauss 2wheeler but i want to have a different model what should i do,in case you want to buy a different model than the one you have already purchased you can cancel the existing order and place a new order for the desired model please note the option to cancel the order will not be available after the submission of documents required for processing registration
bgauss,the address while ordering bgauss 2wheeler on flipkart is different from the one on my address proof aadhaar card what should i do now,please cancel the order and place a new order with the correct address for more details you can also contact the brand authorised dealer
bgauss,can i pay for bgauss vehicles registration and insurance on flipkart,currently the option to pay for the registration and insurance is not available on flipkart please note the vehicle registration amount needs to be paid directly to the brand authorised dealer you can choose to buy vehicle insurance from the dealer or on your own from a different insurance service provider
bgauss,will i get any extra discountnocost emi at the bgauss dealership for insurance and vehicle registration charges,please reach out to the brand authorised dealer for any discountrelated information if the service is being purchased from them kindly note the vehicle registration charge is a government tax and is the same for all it does not include any discount or the option to pay through emi
bgauss,is the warranty for bgauss 2wheelers being offered by flipkart,please note the warranty will be provided by bgauss
bgauss,will bgauss crosssellupsell when i visit the brand authorised dealer,please note once youve completed the purchase on flipkart the brand authorised dealer will not market any other products however they may recommend accessories that may be suitable for your vehicle
bgauss,how do i contact bgauss for 2wheeler related queries,you can visit bgausss website or contact them at 8291939393
bgauss,how do you make sure that i dont get unwarranted calls for crosssellupsell from bgaussinsurance partners etc,bgauss may contact you only to recommend accessories in case you receive any unwarranted calls please contact the brand at 8291939393 and they will help you
