category,question,answer
flipkart axis bank credit card,can i resume an incomplete application,yes you can resume filling an incomplete application within 4 hours of initiation by clicking on the resume application button available on the banner on our homepage if you are trying to resume the application after four hours then you will have to restart the application process from the beginning
flipkart axis bank credit card,how can i track my application status from my flipkart account,the application status will be immediately communicated to you once the application process is completed you can also view the details by visiting the my account section of your flipkart account and clicking on flipkart axis bank credit card section 1 the application status is immediately communicated to you on the app after the application process is completed youll also get an sms  email from axis bank as soon as the application is processed
flipkart axis bank credit card,is there any annual fee,yes theres an annual fee of rs 500 applicable on the card the annual fee will be waived off if you spend rs 2 lakh with the card within a year
flipkart axis bank credit card,what can i purchase using flipkart axis bank credit card,you can use this credit card for all your purchases both on and off flipkart
flipkart axis bank credit card,will i earn cashback if i have used someone elses flipkart axis bank credit card,please note that the cashback will be credited to the account of the card used
flipkart axis bank credit card,how can i use the earnings,all cashback is credited as cash to your credit card account which can be used for your future purchases three days before the statement for the next month is generated
flipkart axis bank credit card,can i transfer ownership of my flipkart axis bank credit card,no ownership of the credit card cannot be transferred
flipkart axis bank credit card,what will happen to the cashback if i return a product,if you return a product within the same credit card billing cycle in which the purchase was made applicable cashback will be debited in the same cycle otherwise it will be adjusted in the next billing cycle
flipkart axis bank credit card,how will i get the pin for the card,you can get the pin for the card by visiting this link httpswwwaxisbankcomretailcardscreditcardusefullinkscreditcardauthentication
flipkart axis bank credit card,i did not get the correct cashback as per my transactions on flipkart what should i do,to know more about cashback please reach out to axis bank customer support at 1860 419 5555
flipkart axis bank credit card,i want to know the cvv number on the card,the virtual card and cvv are available in the flipkart axis bank credit card section under my accounts section of the app once the physical card is delivered to you the cvv number is available behind your card disclaimer please do not disclose your pin or cvv to anyone in case your card is misused bank or flipkart wont be responsible for any unauthorised transactions that may have happened due to the disclosure
flipkart axis bank credit card,how can i pay the outstanding bill,to know about payment options please reach out to axis bank customer support at 1860 419 5555
flipkart axis bank credit card,will the card number and cvv remain the same for both the physical and the virtual card,yes it will remain the same
flipkart axis bank credit card,when will i get the physical card,the physical credit card will be delivered to your registered address with axis bank within 7 to 10 business days of application approval
flipkart axis bank credit card,what are the key benefits of flipkart axis bank credit card,some of the benefits of flipkart axis bank credit card are 5 cashback for spends on flipkart myntra 2gud 4 cashback for spends on preferred partners makemytripgoibibo uber pvr curefit urbanclap 15 cashback for spends on all other merchants no cost emi applicable for purchases on flipkart for all tenures four complimentary domestic lounge access visits 1 fuel surcharge waiver upto rs 500 per monthwelcome benefits flipkart gift card of rs 500 as an activation benefit for transacting with the card anywhere for any amount 15 cashback upto rs 500 on myntra rs 500 off on domestic hotels via makemytrip rs 500 off on domestic hotels on goibibo benefits of upto rs 900 unlimited access to 6 months of gaana plus membership 50 off for the next 6 months 20 off upto rs 400 on urbanclapplease click here for terms and conditions
flipkart axis bank credit card,how can i apply for flipkart axis bank credit card am i eligible for the card,you can apply for the flipkart axis bank credit card by visiting the flipkart home page and clicking on apply now on the banner or by going to the flipkart axis bank credit card section under my account alternatively you can apply for the card through axis banks channels such as by visiting any of their branches tablet sourcing axis bank mobile banking app etc
flipkart axis bank credit card,what is flipkart axis bank credit card,flipkart axis bank credit card is a credit card issued by axis bank in association with flipkart internet pvt ltd flipkart and mastercard every purchase that you make on flipkartcom and outside flipkartcom will earn you unlimited cashback that will be credited to your credit card account you can use these cashback for your future purchasesplease note that a joiningannual fee of rs 500 is applicable unless it is acquired under the first year free offer
shopping,why do i see different prices for the same product,you could see different prices for the same product as it could be listed by many sellers
shopping,is installation offered for all products ,installation and demo are offered for certain items by sellers through the brand or an authorised service provider please check the individual product page to see if these services are offered for the item
shopping,is it necessary to have an account to shop on flipkart,yes its necessary to log into your flipkart account to shop shopping as a loggedin user is fast  convenient and also provides extra securityyoull have access to a personalised shopping experience including recommendations and quicker checkout
shopping,what does preorder or forthcoming mean,items marked as preorder or forthcoming are expected to be released soon and you can prebook them with sellers such items will be shipped after their official release by the seller with whom youve prebooked them
shopping,do sellers on flipkart ship internationally,currently sellers on flipkart only ship within india
shopping,can i use an item that has been given to me as a gift from a state sponsored or an ngofunded freebie distribution programme to get discounts through exchange offers,no as per company policy such items are not eligible for discounts under exchange offers you can also refer to the exchange offers section in the terms of use page for more details
shopping,will i get a wall mount for my television in the box,if mentioned in the sales package the wall mount for your television will be in the box however in some cases the wall mount if applicable for the model will be with the installation team
shopping,can i order a product that is out of stock or temporarily unavailable,the products listed as out of stock or temporarily unavailable are not available for sale please use the notify me feature to be informed of the products availability with sellers on flipkart
shopping,what does out of stock mean,an item is marked as out of stock when it is not available with any sellers at the moment you wont be able to buy it now use notify me feature to know once its available with sellers for purchase
shopping,what does permanently discontinued or out of print mean,an item is marked as out of stock when it is not available with any sellers at the moment you wont be able to buy it now use notify me feature to know once its available with sellers for purchase
shopping,what is flipkart buyer protection,flipkart buyer protection helps shoppers in case they have concerns with products bought and havent got a satisfactory solution from the seller under this program we look into your concern on a casebycase basis  do our best to be fair to both parties flipkarts decision on the resolution will be final for the concern raised
shopping,how does instant cashback work,instant cashback is applied directly to the product or order value in your cart and you do not have to wait for the cashback to be credited to your bank accountcredit or debit card at a later date
shopping,are there any hidden charges octroi or sales tax when i shop on flipkart,there are no hidden charges when you shop on flipkart the price you see on the product page is final and its exactly what you paynote there can be additional delivery charges based on the sellers policy
shopping,why do i see different prices for books with the same title,you can find various editions of books with the same title on flipkart  from paperbacks or hardcovers to collectors editions some of them are republishedprinted within india while some editions are imported the price of the titles varies based on this and the seller offering itall other available editions and their prices for a particular title are mentioned on the respective product page under other editions 
shopping,can i club my orders from different sellers to be delivered together,currently there is no option to club orders from different sellers to be delivered together as sellers could be located in different locations and the delivery timelines would vary based on their partnered courier service providers to ensure your items reach you at the earliest each seller ships their products as per their individual timelines
shopping,why do i see a delivery charge,it usually costs sellers more to ship some items so sometimes they choose to add a delivery charge the delivery charge is waived off by some sellers if you shop with them for a certain amount for more information check the individual sellers policy on the product page
shopping,is flipkart advantage the same as plus,no while flipkart advantage was the tag for all items listed by sellers who used our partner warehouse services the plus badge is only given to select items based on certain criteria such as product quality and delivery timeline
shopping,do i have to pay extra for items with the plus badge,no you can shop for items with the plus badge at no extra charge
shopping,is there a filter available through which i can only see items with a plus badge,yes there is a filter available through which you can shop only for items with the plus badge
shopping,what are the benefits of buying an item with a plus badge,items with the plus badge are extensively quality checked from storage to transit safe packaging and also comes along with fast  free delivery from our best sellersfree shipping for orders above rs 500
shopping,what does the badge plus mean,the plus badge is a seal of quality and speed products with this badge meet our extensive quality  packaging guidelines along with having faster delivery timelineswith stringent seller  product selection combined with fast  free delivery plus guarantees you a superior and hasslefree shopping experience every timefree shipping for orders above 500
shopping,why do i see a shipping charge for an item with the plus badge,sellers may charge a nominal fee for shipping even for products with the plus badge if the order is less than  500shipping is free for items with the plus badge if the order value is more than  500
wallet,what can i do if the balance in my wallet is not enough to pay for my order,you can pay part of the amount through your wallet and the remaining through any other prepaid payment modes like creditdebit cards and flipkart gift cardsplease note that wallet cannot be combined with cashcard on delivery cod payment mode for now and bank offers will not applicable for partial payments from the wallet
phonepe,can i choose phonepe wallet as a refund option,yes you can choose to have the amount refunded to your phonepe wallet provided the balance does not exceed 20000
phonepe,do i need to install the phonepe app to use the wallet option on my flipkart account,no you will be able to use the wallet option on your flipkart account for payments without installing the phonepe appyou can choose to install the phonepe app to access other payment features
phonepe,how long will it take for a refund from flipkart to my phonepe wallet,refund to your phonepe wallet is instant and will be credited to your wallet as soon as the pickup or a cancellation is confirmed by the sellers or courier service providers
phonepe,i had some amount in the flipkart money section and would like to transfer it to my bank will i need to install the phonepe add to do this,you can easily transfer the amount to your account from the flipkart app or websiteyou would not have to install the phonepe app to transfer money from your phonepe wallet to your bank account
phonepe,if my refund amount exceeds 20000 will i get the option for phonepe upi linked account and other registered account for neft or imps,you can easily transfer the amount to your account from the flipkart app or website you would not have to install the phonepe app to transfer money from your phonepe wallet to your bank account
phonepe,will i have to use the same contact number to create a phonepe account as the one linked to my flipkart account,no you dont have to use the same contact number
phonepe,is it necessary to register with phonepe to use it on flipkart,no its not necessary to register with phonepe to pay from your wallet registration will be necessary if you want to pay directly from your bank account by linking it to the phonepe app
phonepe,is phonepe wallet available on flipkarts windows and ios apps too,yes phonepe wallet is available on our windows and ios apps too
phonepe,my phonepe wallet is not activated how do i get a refund credited to it,to get a refund into your phonepe wallet please activate it from your flipkart account by selecting wallet and clicking on the activate phonepe option
shipping,why are faster delivery options not available at my location,faster delivery options may not be available at your location due to courier related reasons but were trying to expand our services to include more places stay tuned for updates
shipping,why cant i get some items shipped to my location,some sellers prefer not to ship to certain locations due to the cost involved and this is entirely at their discretion you can check with your pincode on the product page to see any other sellers ship to your location
shipping,are faster delivery options like same day  inaday available on return requests,no however we try our best to have your items picked up by our courier service providers  get you the replacement as soon as possible 
shipping,what are the standard shipping speeds and delivery charges,standard shipping speeds and delivery charges for fassured flipkart assured and non fassured items vary based on the destination pincode entered  orders with items that are fassured worth rs 500 or more will qualify for free delivery else a delivery charge of rs 40 will be applicableall grocery fsupermart orders worth rs 1200 or more are eligible for free deliveryyou can check if an fassured item can be delivered to your location by entering a delivery pincode on the product page this widget is placed next to the section delivery and hitting enter available shipping speeds and delivery charges as per your location will be displayedfor certain items you can choose the delivery speed accordingly in order summary page while placing the orderfor grocery orders you can choose from the following delivery slots1 700 am to 930 am2 930 am to 1200 pm3 500 pm to 730 pm4 730 pm to 100 pmstandard shipping speeds and delivery charges for non fassured itemsdelivery charges and shipping timelines may vary based on seller delivery timeline is displayed on the product page you can choose a delivery pincode on the product page and it will display the list of sellers who cater to that location and the applicable shipping charges
shipping,why didnt my order qualify for free delivery,your order qualifies for free delivery if you order fassured products worth rs 500 and above if your order value for fassured products is less than rs 500 a delivery fee of rs 40 will be chargedfor products that are nonfassured delivery charges if any will be decided by the sellers and will vary please click on view sellers under the seller rating on the product page for information about sellers selling any particular product and their respective delivery charges
shipping,why am i unable to order products like television airconditioner refrigerator washing machine furniture microwave treadmill etc at my location,the delivery of large category products at a particular location depends on the following factorsdimensions and weight location of the sellerserviceability of the sellers partnered service provider always ensure to update your preferred delivery locationaddress to verify if the seller is offering the product or deal at your location
shipping,how do i contact sellers partnered courier service providers,here are the contact details of some of the leading courier service providersekart  wwwekartlogisticscomgati  wwwgaticomdelhivery  wwwdelhiverycomblue dart  wwwbluedarttrackingsinecom  wwwecomexpressindotzot  wwwdotzotinspeed post  india post  wwwindiapostgovin
flipkart first,how can i buy using a gift card,its simple when youre prompted to choose a payment method for your order choose gift card as the payment method 1 enter your 16digit gift card number  the 6digit gift card pin2 click confirm orderyou can apply a total of 15 gift cards per order  if your gift card value is less than the order amount youll be asked to select an additional payment method to complete the payment 
selling on flipkart,how can i become a seller and start selling products on flipkart,to become a seller on flipkart register here with your details
product reviews,are there any guidelines for writing product reviews,product reviews on flipkartcom are a great way to help other customers decide what to buy  avoidhere are some tips to writing great product reviewshave you used this product its always better to review a product you have personally usededucate your readers provide a relevant unbiased overview of the product readers are interested in the pros and the cons of the product make sure your review stands the test of time and what you write today is relevant even after yearsbe yourself be informative let your personality shine through but its equally important to provide facts to back up your opinionget your facts right nothing is worse than inaccurate information if youre not really sure research always helpsstay concise be creative but also remember to stay on topic a catchy title will always get attentioneasy to read easy on the eyes a quick edit  spell check will work wonders for your credibility also break reviews into small easy paragraphs
product reviews,what can i write in product reviews,customer reviews should be relevant to the product in question the product review section on flipkart is for you to share your opinion on the product  for other shoppers to have an informed buying decision
product reviews,whats not allowed in product reviews,customer reviews should be relevant to the product in question the product review section on flipkartcom is for you to share your opinion on the product and for other customers to research better and have an informed buying decision flipkartcom reserves the right to remove reviews that include any of the following irrelevant review review consisting of a combination of random characters random words repeated content reviews on another product service feedback including availability order or payment related queries you may use the contact us form for such queries html embedded in text references to other retailers pricing related comments personal information phone numbers postal address email address and others profane comments inflammatory comments copyrighted comments plagiarised content any content found elsewhere on the internet even if youre the original author promotional content reviews by or on behalf of a person or company with a financial interest in the product or a competitors product reviews by authors artists publishers manufacturers without disclosure reviews written for any form of compensation reviews given using fake ids irrelevant user email ids  asking for helpful votes review in any language other than english unless there is a clear connection to the product like a regional book or a regional music album feedback about errors in the product description
login  my account,can i reactivate my inactive flipkart account,yes to reactivate your flipkart account simply log in with your registered email id or mobile numberpassword combination used before deactivation your account data will be fully restored default subscription settings applied
login  my account,do i need to verify my mobile number or email address every time i log in,as the verification step is a one time process you wont have to do it again once your account is verified
login  my account,what should i do if i dont get the otp or verification code,sometimes sms messages may be delayed by a few minutes because of network issues you can regenerate the code through the resend code option
login  my account,what is an otp or verification code,an otp one time password or verification code is a passwordcode used to verify your mobile number or email id when you log into your flipkart account for the first timeotp verification will be also be done in other cases like creating an account password recovery and updating emailmobile details
login  my account,why do i need to verify my mobile number or email address to log into my flipkart account,to make sure that your account details are always secure verification by otp one time password is important this is a onetime process and you can log into your flipkart account without any hassles once this is done 
login  my account,how can i add a new delivery address to my flipkart account,to add a new delivery address follow these simple steps1 log into your flipkart account1 log into your flipkart account2 go to my account  settings  addresses3 add details of your new address 4 choose save changes
login  my account,how can i change the password for my flipkart account,to change the password for your flipkart account follow these simple steps1 log in to your flipkart account2 go to my account  settings  change password3 enter your old password4 enter your new password5 choose save changes
login  my account,how can i use a new email address to log in to my flipkart account,to log in to your flipkart account with a new email address you can update your email id with these simple steps1 log in to your flipkart account2 go to my account  settings  update emailmobile 3 add the new email id 4 enter the verification code sent to the new email id 5 choose save changesplease note once your email address is updated youll no longer be able to sign in using your old email id
login  my account,how can i deactivate my account,to deactivate your flipkart account follow these simple steps 1 log into your flipkart account2 go to my account  settings  deactivate3 enter the password for your account4 choose confirm deactivation
login  my account,how can i change the email id linked with my flipkart account,to change the email id associated with your flipkart account follow these simple steps on our website1 log in to your flipkart account2 go to my account  settings  update emailmobile3 add the new email id 4 enter the verification code sent to your old and new email ids5 choose save changes
login  my account,can i use an international number to sign up,yes you can use an international number to sign up this number can only be used for logging in and subscribing to orderrelated updates and confirmation details
login  my account,how can i use my mobile number to login on the flipkart mobile app,to log into the flipkart mobile app update your mobile number from your flipkart account on our website with these simples steps1 go to my account  settings  update emailmobile 2 add your mobile number3 enter the otp received on your registered mobile number4 select save changes
login  my account,can i use a corporate email id to sign up,yes you can use a corporate email id however please ensure that you have updated your current active email address to continue using your account in the unlikely event of your account getting deleted or deactivated
login  my account,im getting an error message that says youve exceeded the maximum number of attempts to enter correct verification code how can i log in to my flipkart account now,if a wrong code is entered for verification more than a specific number of times this error message will be seen and for security reasons your account will be blocked for the next 24 hours to log in please try again after 24 hours by entering the correct otp 
login  my account,i always login using my phone number but i recently lost my phone i have also forgotten the password to my flipkart account how do i access it,if you have forgotten the password for your account you can reset it using the forgot password option available on the home page just enter your registered email id to get an otp once you have the otp simply follow the prompts if you regain access to your phone number you can always log in using otp else if an email id is registered with your account you can click on forget password and attempt to log in in the unlikely event of these not working you can contact our customer support team for further assistance
