category,question,answer
order,i missed the delivery of my order today what should i do,the courier service delivering your order usually tries to deliver on the next business day in case you miss a deliveryyou can check your sms for more details on when the courier service will try to deliver again 
order,will the delivery be tried again if im not able to collect my order the first time,couriers make sure that the delivery is reattempted the next working day if you cant collect your order the first time
order,the delivery of my order is delayed what should i do,on the rare occasion that your order is delayed please check your email  messages for updates a new delivery timeframe will be shared with you and you can also track its status by visiting my orders 
order,what should i do if my order is approved but hasnt been shipped yet,sellers usually ship orders 12 business days before the delivery date so that they reach you on time in case your order hasnt been shipped within this time please contact our customer support so that we can look into it
order,can i take the shipment after opening and checking the contents inside,as per company policy a shipment cant be opened before delivery but you can accept the shipment and get in touch with us later in case you have any concerns
order,how do i know my order has been confirmed,an email  sms will be sent once youve successfully placed your order well also let you know as soon as the seller ships the items to you along with the tracking numbers for your shipments you can track your orders from the my orders section on your flipkart account n 
order,how quickly can i get my order delivered,orders will be delivered by the date you see on the product page for your location 
order,my order has reached the nearest delivery hub but why isnt it out for delivery yet,the courier service delivering your order are responsible for making sure that your order reaches you within the delivery date rest assured youll get an sms once your shipment is out for delivery
order,my order status shows out for delivery but i havent got it yet when will i get it,the courier service will contact you for delivery of your order please check your sms for more details
order,why cant i track my order even though it has been shipped,courier services usually take upto 24 hours to activate tracking for an order once its shipped please check again after the mentioned time frame
order,what should i do if i dont get the invoice for my order,sellers send a hard copy of the invoice in the shipments a soft copy is also emailed to you within 24 hours of delivery in the delivery confirmation email sent to your registered email idyou can also visit my account  my orders page to get invoices for your orders
order,how do i get invoices for my previous orders without having to check my emails,you can easily send invoices to your email id from your flipkart account to do so visit my account  orders choose the order for which youd like the invoice for and click on the email invoice option
order,should i call flipkarts customer care for installation once my product is delivered,to make sure that you have a smooth and hasslefree experience the installation is automatically arranged for your product by the seller within 25 business after the item is delivered you will also get an sms with the exact installation details after delivery
order,will my product be installed by the brand or flipkart if it is installed by flipkart will it affect the warranty of the product,your product will be installed by the brands authorised service partner rest assured the warranty for the product will not be affected when an item is installed by the authorised partners
order,how will my order be delivered,all orders are shipped by sellers through courier services who deliver the packages to your doorstep or the nearest pickup store if the option is selected
order,why is the cash on delivery payment mode not available at my location,availability of the cash on delivery payment mode depends on the courier services delivering to your location please enter your pincode on the product page to check if this payment mode is available at your location courier service providers also have limits on the amount you can pay through cash on delivery based on the destination and your order could have exceeded this limit
order,where can i find the sellers returns policy,you can see the respective sellers returns policy on the product page
order,what does the tag imported beside a product mean,sometimes items have to be sourced by sellers from their international partners such items have the tag imported on the product page and can take at least 10 or more days to be delivered
order,how can i place an order,to place an order please follow these steps1 select the product youd like to buy and check availability at your preferred pincode2 add products to your cart or just hit buy now 3 choose or add delivery address use a preferred payment mode and confirm the order
order,i have a complaint about the courier executive who came to deliver my order,you can contact our customer support team with the details and we will get in touch with the courier service provider to resolve your complaint
order,what should i do if a service centre denied my request to repair the product,please contact our customer support with the service centre details so that we can look into this
order,can i get my order delivered faster,your order will get delivered on or before the delivery date promised at the time of placing the order
order,how is a business day different from a regular day,business days are otherwise known as working days of the week the expected date of delivery is calculated based on business days typically these include monday through saturday public holidays and sundays are usually not considered
order,what is the estimated delivery time,sellers generally procure and ship the items within the time specified on the product page business days exclude public holidays and sundays estimated delivery time depends on the following factors the seller offering the product products availability with the seller the destination to which you want the order shipped to and location of the selleryou can check the expected delivery date of your orders on the my orders section of your flipkart account on our website app or mobile site
order,how can i trust that the groceries that will be delivered are quality checked and fresh,groceries on flipkart are available from top brands such as hul pg itc etc which are renowned for their quality products seller also checks the freshness of groceries when they receive the stock from vendors and before the dispatch of items in order to ensure that only the best produce and packaged groceries reach you 
order,my package shows as delivered but i cant find it what should i do,if your tracking information shows that your package was delivered but you cant find it check your phone for any notification about attempted deliverysee if any of your neighboursfriendsrelativeshouse ownersecurity guard has collected your product on your behalfwait until the end of the day sometimes packages can show as delivered while still in transit in the unlikely event of you still not being able to locate your item please contact us and we will be happy to help
order,why was my package not delivered,sometimes a package cannot be delivered due to one of the following reasons incorrect address if the address is incorrect or outdated the package is usually returned to the seller by the courier service provider or the unintended recipient please doublecheck your address carefully when placing a new order to remove an outdated or incorrect address from your account go to my account  my addresses click on the 3dot button beside the address you want to modify and select edit and then choose save changesother address problems in rare cases it is also possible that the address label was difficult to decipher during the shipping and handling process or that the courier service left the package at a different address than what was printed on the labelfailed delivery attempts most of the sellers partnered courier service providers make more than one attempt to deliver a package if nobody is available to accept the delivery after multiple attempts the package is returned to the sellerdamaged during transit if a package is damaged on its way to you the courier service provider will return it to the seller without attempting deliverynote a package once returned to the seller cannot be delivered again by the courier service provider please place a new order on our website or app if you would still like to purchase the item
order,what do the different order statuses in my orders mean,the different order statuses are as mentioned belowapproved order you have placed for an item is confirmed by the sellerready to ship your item is packed and ready for pick up by a courier service provider dispatched your item has been picked up from the seller by the courier service provider and is on its way to a logistic facilityshipped your item is on its way to youout for delivery a wish master is out to deliver your orderdelivered your item has been deliveredreturn requested you have created a return request for the item which is pending confirmation from the sellerreturned you have returned the item for refundreplacementexchange
order,what is gstin invoicing feature,through gstin invoicing feature customers can enter their business entity details and gstin associated with the business entity in order to receive a tax invoice containing these details to claim input tax credit please note this is available on select products for business purchases sold by participating sellers
order,who are all eligible for this gstin feature,customers that have gstin registered for their business entity can avail this feature please note that this is currently available on select products for business purchases sold by participating sellers customers can enter gstin and business entity name while placing the order to receive a tax invoice containing these details to claim input tax credit
cancellations and returns,if i request for a replacement when will i get it,visit my orders to check the status of your replacementin most locations the replacement item is delivered to you at the time of pickup in all other areas the replacement is initiated after the originally delivered item is picked up please check the sms  email we send you for your replacement request for more details
cancellations and returns,which products are not eligible for returns,the following table contains a list of products that are not eligible for returns as per the sellers returns policycategoryproducts that cant be returnedauto accessoriesadditives air fresheners brighteners cleaners bikecar stickers degreasers dentscratch removers filler putty headlight vinyl films liquid solutions lubricants polish power steering fluids sealants oils and waxautomobilescars mopeds motorcycles and scootersbath and spabath bubblesaltspongewash body wash loofahs scrubs shampoos and soapsbaby carebottle nipples breast nipple care breast pumps diapers ear syringes nappy wet reminder wipes and wipe warmerscleaning productscleaning gels detergents detergent pods fabric wash products surface cleaners stain removers and washing barspowdercomputer accessoriesblankeducational media cdsdvds ink toners music movies and softwarefood and nutritioncanned food condiments drinks fruits health supplements meat seafood syrups vegetables and other edible productsfashionbaby dolls clothing freebies lingerie washbags shapewear socks stockings and swimsuitsfootwear accessoriesoils glue grease socks shoe deodorantspolish creamssprays and waxgardening productsplant saplings plant seeds and soil manurehealth careantiseptic band aid body pain relief eye drops first aid tape glucometer lancetstrip healthcare devices and kits medical dressinggloves and ph test striphome productsadhesives barbeque wood birdinsect repellent contact cement crack fillers inks guitaryoyo friction stickers marker refills mosquito coilvaporiservaporiser refills naphthalene balls scubasmokingpipe mouthpieces and sprayshygienecannula contact lens ehookah fake moustache female urination devices menstrual cups needles panty liners shaving products smoking patch straws sweat pads tampons teeth whitening productswipes tissues toilet tissue aid toilet rolls and women intimate careinnerwearbra accessories briefs boxers lingerie sets panty garter trunks and vestsjewellerycoinsmusic instrument accessoriesmouthpiece cappadset oils and polishparty suppliesballoons candles cutouts decoration articles and whistlesfestive supplieshookah charcoalflavormouthtip incense sticks and holirangoli colorpersonal careconditioners creams deodorants electric ear cleaners eyebroweyelashhair styling products eye mask face wash face carefairness products fragrance fresheners gels hair care kajal lens solution lip plumperstain blackheadmakeupnail paint removers mascara mehendi nail sanding pad oils oral hygiene products perfumes handtoothbrush sanitizers serums talc sunscreen tanning liquid tattoo toners and wigspet suppliesaquarium consumables hair styling health caremedicinal products horse girthgrooming kitbraid tail baghaylinimentpoultice inhaler masks litter box enclosures litter scoops pet chew pet foodtreat pet pad pet hygienepersonal care products poultice tail wraps waste bags and water troughssexual wellnesscondoms fertility kitsupplement lubricants pregnancy kits sexual massagers sexualpleasure enhancement products and vaginal dilatorskindly always check a products returns policy on the product page click here to view the returns policy
cancellations and returns,can items be returned after the time period mentioned in the sellers returns policy,no sellers will not be able to accept returns after the time period mentioned in the sellers returns policy
cancellations and returns,do i have to return the freebie when i return a product,yes the freebie has to be returned along with the product
cancellations and returns,how do returns work,you can raise a request to return your items with these simple steps 1 log into your flipkart account2 go to my orders3 click on return against the item you wish to return or exchange4 fill in the details and raise a return request once you raise a request youll get an email and sms confirming that your request is being processed based on the item your request may be automatically approved or you may be contacted for more details if the request is approved the item will be picked up after which you will get a replacement or refund you can also track the status of your return request instantly from the my orders section of your flipkart account
cancellations and returns,i see the cancel button but i cant click on it why,a greyed out and disabled cancel button can mean any one of the following1 the item has been delivered alreadyor2 the item is nonrefundable eg gift card
cancellations and returns,what is the buyer protection policy,the buyer protection policy mediates buyerseller disputes in case a seller declines your request for a return of an item and you are not convinced with the reason given you can write to us at resolutionflipkartcom for buyer protection you can dispute the resolution that the seller has shared for your issue until 45 days from the date of delivery and concern is looked into by us on a casetocase basis
cancellations and returns,what should i do if i have an issue with my product after the return period,you can get in touch with the brand or an authorised service centre of the brand to claim the warranty for your product wherever applicable
cancellations and returns,how can i return or exchange an item,to returnexchange your order follow these simple steps 1 go to my orders 2 choose the item you wish to return or exchange 3 fill in the details 4 choose request return   
cancellations and returns,when is a return of an item not possible,sellers cannot accept returns of items in the following cases1 when an item is damaged because of use or when it is not in the same condition as you received it2 when any consumable item has been used or installed3 when anything is missing from the package youve received including price tags labels original packing freebies  accessories 4 when nonreturnable items are involved such as innerwear lingerie etc5 when items are tampered with or have missing serial numbers
cancellations and returns,how can i know the status of my refund,you can visit my orders to know the status of your refundfor orders cancelled before shipping refunds are processed immediately if the order has been shipped refund will be processed as soon as the courier service provider confirms the return of the items
cancellations and returns,what are the modes of refund available after cancellation,the different refund modes available are1 phonepe wallet  available for orders with select sellers  you will get this option for eligible orders during cancellation2 back to source  available for orders with all sellers the amount is refunded to the payment mode that was originally used to pay for the order3 neft transfer  available for all cashondelivery orders as per policy cash refunds are not possible
cancellations and returns,when are refunds given,refunds are given when the seller cannot provide a replacement a dispute has been ruled in your favour inline with buyer protection sellers allow refunds on select categories under certain conditionsplease check the sellers returns policy on the product page for more details
cancellations and returns,i ordered a wrong item can i return it,the sellers return policies dont support the return of items ordered wrongly you can refer the respective sellers returns policy on the product page
cancellations and returns,what should i do if i find the package open or tampered on delivery,you can request for the item to be replaced by visiting my orders use the return option  fill out the details of the issue so that we can help you
cancellations and returns,can i change the address for the pickup the of items in my order,if the pincode of the new address is serviceable for pickup the address can be changed while creating the return the address cannot be changed in case the new address is not serviceable
cancellations and returns,why have i been asked to ship the item,when pickup facility is not available for your location as per the courier service providers you may be asked to ship the item back to the seller since the seller can arrange for a refund or a replacement only after the item reaches them please make sure that the item is sent to the address mentioned in the return related email within 30 days of the email being sent to youthe seller may not be able to proceed with the return request if the item does not reach the specified address within 30 days
cancellations and returns,what is the pickup process,once your return or replacement or exchange request is accepted the pickup of the originally delivered product will be scheduled an sms with more details will be sent to you on the day of the pickupin cases where pickup service is not available from the courier service providers at your location you may be asked to ship the item back to the seller within 30 days of the return related email being sent to you
cancellations and returns,i have requested for a return for my item when will it happen,you can now track the status of your return easily right from your flipkart account or mobile app just visit the my orders page to see its status along with the date of pickup and status of your refund if applicableyou will also receive an email  sms with the details of your return
cancellations and returns,i have requested a replacement when will i get it,you may visit my orders to check the status of your replacement in most locations the replacement item is delivered to you at the time of pickup in all other areas the replacement is initiated after the originally delivered item is picked up please check the sms  email that will be sent to you for your replacement request for more details
cancellations and returns,ive still not received the refund in my bank account,if you have received a mail from us confirming your refund request it means that the refund has been initiated you can also contact your bank with the arn you would have received for an update on the status of your refundin the rare event of the amount not being credited by the date promised you can contact us as we will work with the bank to get it done
cancellations and returns,what are the refund timelines if i cancel or return a product,the refund timelines will depend on the payment modes as listed belowdebit card  79 business dayscredit  79 business daysnetbanking  37 business dayscod  imps 1 business daysemi standardno costdebit card  7 9 business daysflipkart pay later  24 to 48 hoursgift card  24 hoursphonepe phonepe wallet  24 hours phonepe upi  1 business day phonepe creditdebit card  7 business daysnote refunds will be credited to the payment source used at the time of placing an orderthe mode of refund in case of payment through cash on delivery will be imps 
cancellations and returns,how will i get my refund for returning an item i paid for using cash on delivery mode,for orders placed using cash on delivery as the payment mode refunds can be processed to your bank account via immediate payment service imps you can update the details of the bank account where you would like to receive the refund while creating the return request for an itemyou will need to update following information for the seller to process a refund to your accountthe bank account numberifsc codeaccount holders namebank branchbank nameimps refunds will typically be processed in one business day by sellers
cancellations and returns,i have not received the reimbursement of my courier charges what should i do,please follow the belowmentioned steps on our website to upload a scanned copy of the receipt from the courier service provider so that we can request the seller for a reimbursement go to flipkart help center and select the relevant order for which the refund has been requested from the issue types choose others and select email us now click on the attachment icon and select the imagedocument you wish to upload please include the return id in your email and click send emailafter the verification the amount will be refunded to you as a gift card in your flipkart accountnote this amount is not withdrawable to your bank account
cancellations and returns,how will i get my refund for returning an item i paid for with cash on delivery,for your cash on delivery order you will receive the refund in the form of neft please update your bank account details after you choose this option
cancellations and returns,how long does it take to cancel an order,cancellation of items in an order happens immediately if the order hasnt been shipped yet by the seller if your order has been shipped it will be cancelled as soon as the courier service confirms that the shipment is being returned to the seller orders from certain categories cannot be cancelled after 24 hours please check the product page for more details
cancellations and returns,what are the checks done for an item that im returning,during pickup your product will be checked for the following conditionscorrect productimei name image brand serial number article number bar code should match and mrp tag should be undetached and clearly visiblecomplete productall inthebox accessories like remote control starter kits instruction manuals chargers headphones etc freebies and combos if any should be presentunused productthe product should be unused unwashed unsoiled without any stains and with nontampered quality check seals warranty seals wherever applicable before returning a mobile laptop tablet the device should be formatted and screen lock pin pattern or fingerprint must be disabled icloud lock must be disabled and icloud deactivation done for apple devicesundamaged productthe product including sim trays charging port headphone port backpanel etc should be undamaged and without any scratches dents tears or holesundamaged packagingproducts original packaging box should be undamagedthe field executive may refuse to accept the return if any of the above conditions are not metfor any products for which a refund is to be given the refund will be processed once the returned product has been received by the seller view a complete list of all nonreturnable products here
cancellations and returns,why do i see a return fee applicable to the order,if your return requests are significantly higher than most customers a return fee will apply to your order this is levied to compensate sellers for the huge losses they incur as part of each return request in case of an issue with the item you can choose to exchange or replace it instead of returning it to avoid these fees for more details you can click know more beside the return fee information on the app at the time of creating a return request
cancellations and returns,how is the return fee determined,the return fee is determined based on the selling price of the product lower the selling price of the product lower the return fee and vice versa
